{
  "artikel-id": "BWBR0004770/art9",
  "bwb-id": "BWBR0004770",
  "wet": "IW 1990",
  "artikel": "9",
  "peildatum": "2026-01-01",
  "structuurpositie": "Hoofdstuk II Invordering in eerste aanleg > Artikel 9",
  "leden-annotaties": [
    "BWBR0004770/art9/lid1",
    "BWBR0004770/art9/lid5"
  ],
  "kruisreferenties": [
    "Art. 2 IW 1990",
    "Art. 8 Wet BPM 1992",
    "Art. 6 Wet BZM",
    "Algemene termijnenwet",
    "Art. 167 Douanewetboek van de Unie"
  ]
}