{
  "artikel-id": "BWBR0004770/art2",
  "bwb-id": "BWBR0004770",
  "wet": "IW 1990",
  "artikel": "2",
  "peildatum": "2026-01-01",
  "structuurpositie": "Hoofdstuk I Algemene bepalingen > Artikel 2",
  "leden-annotaties": [
    "BWBR0004770/art2/lid2"
  ],
  "kruisreferenties": [
    "Art. 1 AWR",
    "Art. 7:3 Algemene douanewet",
    "Hoofdstuk VA AWR",
    "Verordening (EU) 952/2013 (Douanewetboek van de Unie)",
    "Verordening (EU) 2015/2446 (Gedelegeerde Verordening DWU)",
    "Verordening (EU) 2015/2447 (Uitvoeringsverordening DWU)",
    "Art. 1:1 Algemene douanewet",
    "Hoofdstuk VIIa IW 1990",
    "Hoofdstuk VIIIA AWR",
    "Hoofdstuk 9 Algemene douanewet",
    "Art. 2 Wet financiering sociale verzekeringen",
    "Art. 76 AWR",
    "Art. 10:15 Algemene douanewet",
    "Art. 1 Wet algemene bepalingen burgerservicenummer",
    "Art. 112 Douanewetboek van de Unie",
    "Art. 114 Douanewetboek van de Unie",
    "Art. 1 Rijkswet instelling exclusieve economische zone",
    "Wet op de loonbelasting 1964",
    "Zorgverzekeringswet"
  ]
}
